{
  "$schema": "https://json-schema.org/draft/2020-12/schema",
  "$id": "https://example.org/openclaw-reference/schemas/project-layout.schema.json",
  "title": "Namespace and surface binding table",
  "description": "The declaration that answers, for any edit, which single location is authoritative. It binds each top-level storage namespace to a role, and each agent-addressable surface to its canonical root, standing branch, history target, and live-binding evidence.",
  "type": "object",
  "required": ["schema", "namespaces", "surfaces"],
  "properties": {
    "schema": { "type": "string" },
    "namespaces": {
      "type": "array",
      "description": "The four namespace roles. A directory's namespace determines what it may be; matching names across namespaces are different roles, not copies to keep in sync.",
      "minItems": 1,
      "items": {
        "type": "object",
        "required": ["role", "root", "editable_as_source"],
        "properties": {
          "role": {
            "enum": [
              "canonical_projects",
              "mutable_generated_data",
              "shared_git_infrastructure",
              "retained_archives"
            ]
          },
          "root": { "type": "string" },
          "editable_as_source": { "type": "boolean" },
          "holds": { "type": "string" }
        }
      }
    },
    "roots_outside_the_taxonomy": {
      "type": "array",
      "description": "Roots that belong to other chapters of the model and are never source: the immutable release store, the runtime state directory, and the artifact output root.",
      "items": {
        "type": "object",
        "required": ["role", "root"],
        "properties": {
          "role": { "type": "string" },
          "root": { "type": "string" },
          "editable_as_source": { "const": false }
        }
      }
    },
    "retired_parents": {
      "type": "array",
      "description": "Explicitly registered so no alias can later be declared beneath a root that was migrated away from, and no guard hard-fails against a path that is no longer authoritative.",
      "items": {
        "type": "object",
        "required": ["root", "rule"],
        "properties": {
          "root": { "type": "string" },
          "retired_at": { "type": "string" },
          "rule": { "type": "string" }
        }
      }
    },
    "surfaces": {
      "type": "array",
      "description": "One row per agent-addressable repository. A registry row is evidence that the surface legitimately exists; it authorizes nothing.",
      "minItems": 1,
      "items": {
        "type": "object",
        "required": [
          "surface_slug",
          "role",
          "namespace",
          "canonical_source_root",
          "standing_branch",
          "authoritative_history_target",
          "validation_entrypoint",
          "live_binding_ref",
          "last_verified_utc",
          "evidence_ref"
        ],
        "properties": {
          "surface_slug": { "type": "string" },
          "role": { "type": "string" },
          "namespace": { "const": "canonical_projects" },
          "canonical_source_root": {
            "type": "string",
            "description": "The one declared source of truth for this surface, at a time."
          },
          "operator_checkout_root": { "type": ["string", "null"] },
          "standing_branch": {
            "type": "string",
            "description": "The branch the surface is healthy on; verified work is normalized onto it."
          },
          "authoritative_history_target": {
            "type": "string",
            "description": "The remote that preserves canonical history. Mirror and rollback remotes are not it."
          },
          "mirror_targets": { "type": "array", "items": { "type": "string" } },
          "handoff_root": {
            "type": ["string", "null"],
            "description": "An operator-facing copy or sync target; never the delivery mechanism and never canonical."
          },
          "validation_entrypoint": { "type": "string" },
          "live_binding_ref": {
            "type": "string",
            "description": "Pointer into the observed live-bindings snapshot, which records the latest binding actually seen."
          },
          "last_verified_utc": { "type": "string" },
          "evidence_ref": { "type": "string" }
        }
      }
    },
    "rules": { "type": "array", "items": { "type": "string" } }
  }
}
